<?xml version="1.0" encoding="UTF-8"?>
<creatures xmlns="stendhal" xmlns:xsi="http://www.w3.org/2001/XMLSchema-instance"
	xsi:schemaLocation="stendhal ../creatures.xsd ">

	<!-- START: zjawy -->

	<creature name="szkielet uzbrojony">
		<type class="pol/zjawy" subclass="szkielet_waleczny" tileid="pol_zjawy.png:0"/>
		<description/>
		<attributes>
			<atk value="174"/>
			<def value="24"/>
			<hp value="90"/>
			<speed value="0.5"/>
			<size value="1,1"/>
			<resistance value="100"/>
			<visibility value="100"/>
		</attributes>
		<level value="23"/>
		<experience value="350"/>
		<respawn value="980"/>
		<corpse name="humanoid"/>
		<drops>
			<item value="money" quantity="[5,29]" probability="100.0"/>
			<item value="złota kolczuga" quantity="[1,1]" probability="1.0"/>
			<item value="zardzewiała zbroja płytowa" quantity="[1,1]" probability="15.5"/>
			<item value="kość dla psa" quantity="[1,1]" probability="20.0"/>
			<item value="tarcza z czaszką" quantity="[1,1]" probability="0.12"/>
		</drops>
		<equips/>
		<ai>
			<says>
				<noise state="idle follow fight" value="Powiadam ci, nie zabijesz w nas ducha!"/>
			</says>
			<profile name="brave"/>
			<profile name="offensive"/>
			<profile name="human"/>
			<profile name="patrolling"/>
		</ai>
	</creature>

	<creature name="boginka">
		<type class="pol/zjawy" subclass="boginka" tileid="pol_zjawy.png:1"/>
		<description/>
		<attributes>
			<atk value="451"/>
			<def value="67"/>
			<hp value="952"/>
			<speed value="0.9"/>
			<size value="1,1"/>
			<resistance value="100"/>
			<visibility value="100"/>
		</attributes>
		<level value="131"/>
		<experience value="5999"/>
		<respawn value="1999"/>
		<corpse name="humanoid"/>
		<drops>
			<item value="rękawice cieni" quantity="[1,1]" probability="0.00025"/>
			<item value="pluszowy miś" quantity="[1,1]" probability="25.0"/>
			<item value="straszna dynia" quantity="[1,1]" probability="5.0"/>
		</drops>
		<equips/>
		<ai>
			<profile name="brave"/>
			<profile name="offensive"/>
			<profile name="human"/>
			<profile name="patrolling"/>
		</ai>
	</creature>

	<creature name="strzyga polna">
		<type class="pol/zjawy" subclass="strzyga_polna" tileid="pol_zjawy.png:2"/>
		<description/>
		<attributes>
			<atk value="244"/>
			<def value="30"/>
			<hp value="240"/>
			<speed value="1.0"/>
			<size value="1,1"/>
			<resistance value="100"/>
			<visibility value="100"/>
		</attributes>
		<level value="23"/>
		<experience value="2345"/>
		<respawn value="1410"/>
		<corpse name="humanoid"/>
		<drops>
			<item value="money" quantity="[5,20]" probability="100.0"/>
			<item value="zbroja światła" quantity="[1,1]" probability="0.005"/>
			<item value="lazurowe rękawice" quantity="[1,1]" probability="0.0025"/>
			<item value="płaszcz elficki" quantity="[1,1]" probability="0.5"/>
			<item value="półtorak" quantity="[1,1]" probability="0.005"/>
		</drops>
		<equips/>
		<ai>
			<says>
				<sound value="evillaugh-5"/>
			</says>
			<profile name="brave"/>
			<profile name="offensive"/>
			<profile name="human"/>
			<profile name="patrolling"/>
		</ai>
	</creature>

	<creature name="strzyga leśna">
		<type class="pol/zjawy" subclass="strzyga_lesna" tileid="pol_zjawy.png:3"/>
		<description/>
		<attributes>
			<atk value="266"/>
			<def value="33"/>
			<hp value="440"/>
			<speed value="1.0"/>
			<size value="1,1"/>
			<resistance value="100"/>
			<visibility value="100"/>
		</attributes>
		<level value="33"/>
		<experience value="2585"/>
		<respawn value="1141"/>
		<corpse name="humanoid"/>
		<drops>
			<item value="money" quantity="[5,50]" probability="100.0"/>
			<item value="polska tarcza kolcza" quantity="[1,1]" probability="1.5"/>
			<item value="polska tarcza ciężka" quantity="[1,1]" probability="0.01"/>
			<item value="polska tarcza lekka" quantity="[1,1]" probability="0.05"/>
			<item value="polska płytowa tarcza" quantity="[1,1]" probability="1.0"/>
			<item value="polska tarcza drewniana" quantity="[1,1]" probability="10.0"/>
		</drops>
		<equips/>
		<ai>
			<says>
				<sound value="evillaugh-5"/>
			</says>
			<profile name="brave"/>
			<profile name="offensive"/>
			<profile name="human"/>
			<profile name="patrolling"/>
		</ai>
	</creature>

	<creature name="leśna zjawa">
		<type class="pol/zjawy" subclass="lesna_zjawa" tileid="pol_zjawy.png:4"/>
		<description/>
		<attributes>
			<atk value="166"/>
			<def value="66"/>
			<hp value="666"/>
			<speed value="0.9"/>
			<size value="1,1"/>
			<resistance value="50"/>
			<visibility value="50"/>
		</attributes>
		<level value="111"/>
		<experience value="666"/>
		<respawn value="666"/>
		<corpse name="humanoid"/>
		<drops>
			<item value="money" quantity="[1,1]" probability="100.0"/>
			<item value="żelazo" quantity="[1,1]" probability="0.005"/>
		</drops>
		<equips/>
		<ai>
			<says>
				<noise state="idle follow fight" value="Zbłądziłeś rycerzu? Wyprowadzę cię stąd..."/>
			</says>
			<profile name="brave"/>
			<profile name="offensive"/>
			<profile name="human"/>
			<profile name="patrolling"/>
		</ai>
	</creature>

	<creature name="zjawa">
		<type class="pol/zjawy" subclass="zjawa_czarna" tileid="pol_zjawy.png:5"/>
		<description/>
		<attributes>
			<atk value="618"/>
			<def value="58"/>
			<hp value="3224"/>
			<speed value="0.5"/>
			<size value="1,1"/>
			<resistance value="50"/>
			<visibility value="50"/>
		</attributes>
		<level value="62"/>
		<experience value="1920"/>
		<respawn value="2520"/>
		<corpse name="humanoid"/>
		<drops>
			<item value="czarny sztylet" quantity="[1,1]" probability="0.0025"/>
		</drops>
		<equips/>
		<ai>
			<says>
				<noise state="idle follow fight" value="Przebacz Brunhildo!"/>
			</says>
			<profile name="offensive"/>
			<profile name="human"/>
			<profile name="heal" params="5,50"/>
		</ai>
	</creature>

	<creature name="zjawa Brunhildy">
		<type class="pol/zjawy" subclass="zjawa_brunhilda" tileid="pol_zjawy.png:6"/>
		<description/>
		<attributes>
			<atk value="923"/>
			<def value="61"/>
			<hp value="8384"/>
			<speed value="0.5"/>
			<size value="1,1"/>
			<resistance value="50"/>
			<visibility value="50"/>
		</attributes>
		<level value="101"/>
		<experience value="5343"/>
		<respawn value="2686"/>
		<corpse name="humanoid"/>
		<drops>
			<item value="money" quantity="[1,80]" probability="100.0"/>
			<item value="korale" quantity="[1,1]" probability="12.0"/>
		</drops>
		<equips/>
		<ai>
			<says>
				<noise state="idle follow fight" value="Nie przebaczę!"/>
				<noise state="idle follow fight" value="Nigdy nie przebaczę!"/>
			</says>
			<profile name="offensive"/>
			<profile name="human"/>
			<profile name="heal" params="5,50"/>
		</ai>
	</creature>

	<creature name="kostucha">
		<type class="pol/zjawy" subclass="zai_kostucha" tileid="pol_zjawy.png:7"/>
		<description/>
		<attributes>
			<atk value="698"/>
			<def value="69"/>
			<hp value="3818"/>
			<speed value="1.0"/>
			<size value="1,1"/>
			<resistance value="100"/>
			<visibility value="100"/>
		</attributes>
		<level value="340"/>
		<experience value="65432"/>
		<respawn value="18600"/>
		<corpse name="humanoid"/>
		<drops>
			<item value="money" quantity="[1,999]" probability="50.0"/>
			<item value="duży eliksir" quantity="[1,5]" probability="30.0"/>
			<item value="czarne rękawice" quantity="[1,1]" probability="0.0005"/>
			<item value="płaszcz z otchłani" quantity="[1,1]" probability="1.0"/>
		</drops>
		<equips/>
		<ai>
			<says>
				<noise state="idle follow fight" value="Jednym cięciem twą głowę zdejmę! Założysz się?!"/>
			</says>
			<profile name="offensive"/>
			<profile name="human"/>
			<profile name="heal" params="5,50"/>
			<profile name="patrolling"/>
		</ai>
	</creature>

	<creature name="kostucha różowa">
		<type class="pol/zjawy" subclass="zai_kostucha_rozowa" tileid="pol_zjawy.png:8"/>
		<description/>
		<attributes>
			<atk value="808"/>
			<def value="73"/>
			<hp value="3318"/>
			<speed value="1.0"/>
			<size value="1,1"/>
			<resistance value="100"/>
			<visibility value="100"/>
		</attributes>
		<level value="380"/>
		<experience value="67890"/>
		<respawn value="19600"/>
		<corpse name="humanoid"/>
		<drops>
			<item value="money" quantity="[1,666]" probability="50.0"/>
			<item value="duży eliksir" quantity="[1,2]" probability="30.0"/>
			<item value="płaszcz licha" quantity="[1,1]" probability="0.5"/>
			<item value="tarcza licha" quantity="[1,1]" probability="2.5"/>
			<item value="kosa pordzewiała" quantity="[1,1]" probability="2.5"/>
		</drops>
		<equips/>
		<ai>
			<says>
				<noise state="idle follow fight" value="Always look for the bright side of... death!"/>
			</says>
			<profile name="offensive"/>
			<profile name="human"/>
			<profile name="heal" params="5,50"/>
			<profile name="patrolling"/>
		</ai>
	</creature>

	<creature name="żywioł nicości">
		<type class="pol/zjawy" subclass="shadow_elemental" tileid="pol_zjawy.png:9"/>
		<description/>
		<attributes>
			<atk value="441"/>
			<def value="74"/>
			<hp value="380"/>
			<speed value="1.0"/>
			<size value="1,1"/>
			<resistance value="100"/>
			<visibility value="75"/>
		</attributes>
		<level value="55"/>
		<experience value="1850"/>
		<respawn value="1960"/>
		<corpse name="other"/>
		<drops>
			<item value="money" quantity="[5,40]" probability="100.0"/>
			<item value="mocne antidotum" quantity="[1,9]" probability="20.0"/>
			<item value="miecz cieni" quantity="[1,1]" probability="1.1"/>
		</drops>
		<equips/>
		<ai>
			<profile name="brave"/>
			<profile name="offensive"/>
			<profile name="human"/>
			<profile name="patrolling"/>
		</ai>
	</creature>

	<!-- END: zjawy -->

</creatures>