<?xml version="1.0" encoding="UTF-8"?>
<creatures xmlns="stendhal" xmlns:xsi="http://www.w3.org/2001/XMLSchema-instance"
	xsi:schemaLocation="stendhal ../../creatures.xsd ">

	<!-- START: kamienne -->

	<creature name="kamień">
		<type class="pol/kamienne" subclass="kamien" tileid="pol_kamienne.png:0"/>
		<attributes>
			<atk value="97"/>
			<def value="97"/>
			<hp value="12"/>
			<speed value="0.3"/>
			<size value="1,1"/>
		</attributes>
		<level value="20"/>
		<experience value="280"/>
		<respawn value="9600"/>
		<corpse name="rocks"/>
		<drops>
			<item value="kamienie" quantity="[1,2]" probability="100.0"/>
			<item value="kamyk" quantity="[1,19]" probability="100.0"/>
			<item value="buty kamienne" quantity="[1,1]" probability="0.0001"/>
			<item value="płaszcz kamienny" quantity="[1,1]" probability="0.0001"/>
			<item value="kamienna tarcza" quantity="[1,1]" probability="0.5"/>
		</drops>
		<equips/>
		<ai>
			<says>
				<sound value="pol-stones2"/>
			</says>
			<profile name="brave"/>
			<profile name="animal"/>
			<profile name="offensive"/>
		</ai>
	</creature>

	<creature name="wieża">
		<type class="pol/kamienne" subclass="wieza" tileid="pol_kamienne.png:1"/>
		<attributes>
			<atk value="750"/>
			<def value="375"/>
			<hp value="10285"/>
			<speed value="0.2"/>
			<size value="2,2"/>
		</attributes>
		<level value="200"/>
		<experience value="10920"/>
		<respawn value="13449"/>
		<corpse name="giant_rocks"/>
		<drops>
			<item value="kamienie" quantity="[1,9]" probability="100.0"/>
			<item value="kamyk" quantity="[1,39]" probability="100.0"/>
			<item value="buty kamienne" quantity="[1,1]" probability="5.0"/>
			<item value="płaszcz kamienny" quantity="[1,1]" probability="2.0"/>
			<item value="kamienna tarcza" quantity="[1,1]" probability="5.0"/>
			<item value="kamienna zbroja" quantity="[1,1]" probability="1.0"/>
		</drops>
		<equips/>
		<ai>
			<says>
				<sound value="pol-giant"/>
			</says>
			<profile name="brave"/>
			<profile name="animal"/>
			<profile name="offensive"/>
			<profile name="rare"/>
		</ai>
	</creature>

	<!-- END: kamienne -->

</creatures>