<?xml version="1.0" encoding="UTF-8"?>
<creatures xmlns="stendhal" xmlns:xsi="http://www.w3.org/2001/XMLSchema-instance"
	xsi:schemaLocation="stendhal ../creatures.xsd ">

	<!-- START: zbojnicy gorscy -->

	<creature name="zbójnik górski">
		<type class="pol/zbojnicy_gorscy" subclass="zbojnik_gorski" tileid="pol_zbojnicy_gorscy.png:0"/>
		<description>Oto zbójnik górski, który kryje się w jaskiniach.</description>
		<attributes>
			<atk value="250"/>
			<def value="49"/>
			<hp value="290"/>
			<speed value="0.8"/>
			<size value="1,1"/>
		</attributes>
		<level value="59"/>
		<experience value="3110"/>
		<respawn value="3110"/>
		<corpse name="human"/>
		<drops>
			<item value="money" quantity="[9,29]" probability="100.0"/>
			<item value="ciupaga" quantity="[1,1]" probability="0.5"/>
		</drops>
		<equips/>
		<ai>
			<profile name="brave"/>
			<profile name="offensive"/>
			<profile name="human"/>
			<profile name="patrolling"/>
		</ai>
	</creature>

	<creature name="zbójnik górski goniec">
		<type class="pol/zbojnicy_gorscy" subclass="zbojnik_gorski_goniec" tileid="pol_zbojnicy_gorscy.png:1"/>
		<description>Oto zbójnik górski goniec, który donosi o wszystkim hersztowi.</description>
		<attributes>
			<atk value="290"/>
			<def value="52"/>
			<hp value="333"/>
			<speed value="1.0"/>
			<size value="1,1"/>
		</attributes>
		<level value="60"/>
		<experience value="3330"/>
		<respawn value="3110"/>
		<corpse name="human"/>
		<drops>
			<item value="money" quantity="[9,10]" probability="100.0"/>
			<item value="ciupaga" quantity="[1,1]" probability="1.005"/>
		</drops>
		<equips/>
		<ai>
			<profile name="brave"/>
			<profile name="offensive"/>
			<profile name="human"/>
			<profile name="patrolling"/>
		</ai>
	</creature>

	<creature name="zbójnik górski złośliwy">
		<type class="pol/zbojnicy_gorscy" subclass="zbojnik_gorski_zlosliwy" tileid="pol_zbojnicy_gorscy.png:2"/>
		<description>Oto zbójnik górski złośliwy, który chociaż gruby atakuje zwinnie.</description>
		<attributes>
			<atk value="390"/>
			<def value="53"/>
			<hp value="309"/>
			<speed value="0.7"/>
			<size value="1,1"/>
		</attributes>
		<level value="62"/>
		<experience value="3630"/>
		<respawn value="3110"/>
		<corpse name="human"/>
		<drops>
			<item value="money" quantity="[9,99]" probability="100.0"/>
			<item value="ciupaga" quantity="[1,1]" probability="1.5"/>
		</drops>
		<equips/>
		<ai>
			<profile name="brave"/>
			<profile name="offensive"/>
			<profile name="human"/>
			<profile name="patrolling"/>
		</ai>
	</creature>

	<creature name="zbójnik górski zwiadowca">
		<type class="pol/zbojnicy_gorscy" subclass="zbojnik_gorski_zwiadowca" tileid="pol_zbojnicy_gorscy.png:3"/>
		<description>Oto zbójnik górski zwiadowca, który atakuje cicho i nagle.</description>
		<attributes>
			<atk value="330"/>
			<def value="54"/>
			<hp value="345"/>
			<speed value="0.9"/>
			<size value="1,1"/>
		</attributes>
		<level value="63"/>
		<experience value="3530"/>
		<respawn value="3110"/>
		<corpse name="human"/>
		<drops>
			<item value="money" quantity="[9,99]" probability="100.0"/>
			<item value="ciupaga" quantity="[1,1]" probability="1.005"/>
		</drops>
		<equips/>
		<ai>
			<profile name="brave"/>
			<profile name="offensive"/>
			<profile name="human"/>
			<profile name="patrolling"/>
		</ai>
	</creature>

	<creature name="zbójnik górski starszy">
		<type class="pol/zbojnicy_gorscy" subclass="zbojnik_gorski_starszy" tileid="pol_zbojnicy_gorscy.png:4"/>
		<description>Oto zbójnik górski starszy, który chociaż brodę ma siwą zręcznie włada maczugą.</description>
		<attributes>
			<atk value="410"/>
			<def value="51"/>
			<hp value="290"/>
			<speed value="0.5"/>
			<size value="1,1"/>
		</attributes>
		<level value="64"/>
		<experience value="3630"/>
		<respawn value="3110"/>
		<corpse name="human"/>
		<drops>
			<item value="money" quantity="[9,99]" probability="100.0"/>
			<item value="futro" quantity="[1,1]" probability="10.0"/>
			<item value="ciupaga" quantity="[1,1]" probability="1.005"/>
		</drops>
		<equips/>
		<ai>
			<profile name="brave"/>
			<profile name="offensive"/>
			<profile name="human"/>
			<profile name="patrolling"/>
		</ai>
	</creature>

	<creature name="zbójnik górski herszt">
		<type class="pol/zbojnicy_gorscy" subclass="zbojnik_gorski_herszt" tileid="pol_zbojnicy_gorscy.png:5"/>
		<description>Oto herszt zbójników górskich, którego zła sława dotarła daleko poza granice tej krainy.</description>
		<attributes>
			<atk value="440"/>
			<def value="58"/>
			<hp value="490"/>
			<speed value="1.0"/>
			<size value="1,1"/>
		</attributes>
		<level value="66"/>
		<experience value="3830"/>
		<respawn value="6110"/>
		<corpse name="human"/>
		<drops>
			<item value="pióro herszta hordy zbójeckiej" quantity="[1,1]" probability="100.0"/>
			<item value="money" quantity="[9,99]" probability="100.0"/>
			<item value="ciupaga" quantity="[1,1]" probability="8.0"/>
		</drops>
		<equips/>
		<ai>
			<profile name="brave"/>
			<profile name="offensive"/>
			<profile name="human"/>
			<profile name="patrolling"/>
		</ai>
	</creature>

	<!-- END: zbojnicy gorscy -->

</creatures>