<?xml version="1.0" encoding="UTF-8"?>
<creatures xmlns="stendhal" xmlns:xsi="http://www.w3.org/2001/XMLSchema-instance"
	xsi:schemaLocation="stendhal ../creatures.xsd ">

	<!-- START: kamienne wielkie -->

	<creature name="głaz">
		<type class="pol/kamienne_wielkie" subclass="glaz" tileid="pol_kamienne_wielkie.png:0"/>
		<attributes>
			<atk value="140"/>
			<def value="140"/>
			<hp value="25"/>
			<speed value="0.5"/>
			<size value="2,2"/>
		</attributes>
		<level value="40"/>
		<experience value="540"/>
		<respawn value="12200"/>
		<corpse name="giant_rocks"/>
		<drops>
			<item value="kamienie" quantity="[1,3]" probability="100.0"/>
			<item value="kamyk" quantity="[1,59]" probability="100.0"/>
			<item value="buty kamienne" quantity="[1,1]" probability="0.5"/>
			<item value="płaszcz kamienny" quantity="[1,1]" probability="0.5"/>
			<item value="kamienna tarcza" quantity="[1,1]" probability="1.0"/>
			<item value="kamienna zbroja" quantity="[1,1]" probability="0.1"/>
		</drops>
		<equips/>
		<ai>
			<says>
				<sound value="pol-stones2"/>
			</says>
			<profile name="brave"/>
			<profile name="animal"/>
			<profile name="offensive"/>
		</ai>
	</creature>

	<creature name="lawina kamienna">
		<type class="pol/kamienne_wielkie" subclass="lawina_kamienna" tileid="pol_kamienne_wielkie.png:1"/>
		<attributes>
			<atk value="3000"/>
			<def value="700"/>
			<hp value="2000"/>
			<speed value="0.9"/>
			<size value="2,2"/>
			<resistance value="50"/>
		</attributes>
		<level value="400"/>
		<experience value="35920"/>
		<respawn value="128200"/>
		<corpse name="giant_rocks"/>
		<drops>
			<item value="kamyk" quantity="[1,39]" probability="100.0"/>
		</drops>
		<equips/>
		<ai>
			<says>
				<sound value="pol-stones2"/>
			</says>
			<profile name="brave"/>
			<profile name="animal"/>
			<profile name="offensive"/>
			<profile name="rare"/>
		</ai>
	</creature>

	<creature name="olbrzymia wieża">
		<type class="pol/kamienne_wielkie" subclass="wieza_olbrzymia" tileid="pol_kamienne_wielkie.png:2"/>
		<attributes>
			<atk value="2523"/>
			<def value="750"/>
			<hp value="20000"/>
			<speed value="0.1"/>
			<size value="4,3"/>
		</attributes>
		<level value="300"/>
		<experience value="20920"/>
		<respawn value="26898"/>
		<corpse name="giant_rocks"/>
		<drops>
			<item value="kamienie" quantity="[1,19]" probability="100.0"/>
			<item value="kamyk" quantity="[1,69]" probability="100.0"/>
			<item value="buty kamienne" quantity="[1,1]" probability="5.0"/>
			<item value="płaszcz kamienny" quantity="[1,1]" probability="5.0"/>
			<item value="kamienna tarcza" quantity="[1,1]" probability="5.0"/>
			<item value="kamienna zbroja" quantity="[1,1]" probability="9.0"/>
			<item value="spodnie kamienne" quantity="[1,1]" probability="1.0"/>
		</drops>
		<equips/>
		<ai>
			<says>
				<sound value="pol-giant"/>
			</says>
			<profile name="brave"/>
			<profile name="animal"/>
			<profile name="offensive"/>
			<profile name="rare"/>
		</ai>
	</creature>

	<!-- END: kamienne wielkie -->

</creatures>