<?xml version="1.0" encoding="UTF-8"?>
<creatures xmlns="stendhal" xmlns:xsi="http://www.w3.org/2001/XMLSchema-instance"
	xsi:schemaLocation="stendhal ../../creatures.xsd ">

	<!-- START: czart -->

	<creature name="belzebub">
		<type class="pol/czarty" subclass="czart_belzebub" tileid="pol_czarty.png:0"/>
		<description/>
		<attributes>
			<atk value="454"/>
			<def value="37"/>
			<hp value="1662"/>
			<speed value="0.9"/>
			<size value="1,1"/>
		</attributes>
		<level value="150"/>
		<experience value="5112"/>
		<respawn value="4321"/>
		<corpse name="humanoid"/>
		<drops>
			<item value="money" quantity="[99,599]" probability="100.0"/>
			<item value="magia płomieni" quantity="[1,44]" probability="30.0"/>
			<item value="bełt płonący" quantity="[1,19]" probability="100.0"/>
			<item value="różdżka Swaroga" quantity="[1,1]" probability="0.1"/>
			<item value="czarne rękawice" quantity="[1,1]" probability="0.001"/>
		</drops>
		<equips/>
		<ai>
			<says>
				<noise state="idle follow fight" value="Przekroczyłeś wrota piekieł!"/>
			</says>
			<profile name="brave"/>
			<profile name="offensive"/>
			<profile name="human"/>
			<profile name="patrolling"/>
		</ai>
	</creature>

	<creature name="zapomniany diabeł">
		<type class="pol/czarty" subclass="czart_bezimienny" tileid="pol_czarty.png:1"/>
		<description/>
		<attributes>
			<atk value="411"/>
			<def value="31"/>
			<hp value="1541"/>
			<speed value="0.8"/>
			<size value="1,1"/>
		</attributes>
		<level value="120"/>
		<experience value="9876"/>
		<respawn value="3456"/>
		<corpse name="humanoid"/>
		<drops>
			<item value="money" quantity="[1410,1410]" probability="1.0"/>
			<item value="ognista tarcza" quantity="[1,1]" probability="5.0"/>
			<item value="magia deszczu" quantity="[1,11]" probability="10.0"/>
			<item value="trójząb Trzygłowa" quantity="[1,1]" probability="0.05"/>
			<item value="lazurowe rękawice" quantity="[1,1]" probability="0.01"/>
		</drops>
		<equips/>
		<ai>
			<says>
				<noise state="idle follow fight" value="Nie wrócę do piekła! Nie!"/>
			</says>
			<profile name="brave"/>
			<profile name="offensive"/>
			<profile name="human"/>
			<profile name="patrolling"/>
		</ai>
	</creature>

	<creature name="lucyfer">
		<type class="pol/czarty" subclass="czart_lucyfer" tileid="pol_czarty.png:2"/>
		<description/>
		<attributes>
			<atk value="467"/>
			<def value="41"/>
			<hp value="1662"/>
			<speed value="0.9"/>
			<size value="1,1"/>
		</attributes>
		<level value="160"/>
		<experience value="6345"/>
		<respawn value="4321"/>
		<corpse name="humanoid"/>
		<drops>
			<item value="money" quantity="[99,299]" probability="100.0"/>
			<item value="magia płomieni" quantity="[1,22]" probability="5.0"/>
			<item value="bełt płonący" quantity="[1,14]" probability="70.0"/>
			<item value="trójząb Trzygłowa" quantity="[1,1]" probability="0.1"/>
			<item value="karmazynowe rękawice" quantity="[1,1]" probability="0.01"/>
		</drops>
		<equips/>
		<ai>
			<says>
				<noise state="idle follow fight" value="Krwią podpisałeś cyrograf! Pożegnaj się z bliskimi!"/>
			</says>
			<profile name="brave"/>
			<profile name="offensive"/>
			<profile name="human"/>
			<profile name="patrolling"/>
		</ai>
	</creature>

	<creature name="mefisto">
		<type class="pol/czarty" subclass="czart_mefisto" tileid="pol_czarty.png:3"/>
		<description/>
		<attributes>
			<atk value="454"/>
			<def value="37"/>
			<hp value="1662"/>
			<speed value="0.9"/>
			<size value="1,1"/>
		</attributes>
		<level value="140"/>
		<experience value="5112"/>
		<respawn value="4321"/>
		<corpse name="humanoid"/>
		<drops>
			<item value="money" quantity="[11,111]" probability="100.0"/>
			<item value="ognista tarcza" quantity="[1,1]" probability="1.0"/>
			<item value="miecz ognisty" quantity="[1,1]" probability="2.0"/>
			<item value="magia płomieni" quantity="[1,11]" probability="5.0"/>
			<item value="bełt płonący" quantity="[1,10]" probability="10.0"/>
			<item value="złote rękawice" quantity="[1,1]" probability="0.001"/>
		</drops>
		<equips/>
		<ai>
			<says>
				<noise state="idle follow fight" value="Za twe grzechy za twe zbytki, chodź do piekła boś ty brzydki!"/>
			</says>
			<profile name="brave"/>
			<profile name="offensive"/>
			<profile name="human"/>
			<profile name="patrolling"/>
		</ai>
	</creature>

	<creature name="czart starszy">
		<type class="pol/czarty" subclass="czart_starszy" tileid="pol_czarty.png:4"/>
		<description/>
		<attributes>
			<atk value="401"/>
			<def value="36"/>
			<hp value="654"/>
			<speed value="1.0"/>
			<size value="1,1"/>
		</attributes>
		<level value="111"/>
		<experience value="4141"/>
		<respawn value="1987"/>
		<corpse name="humanoid"/>
		<drops>
			<item value="money" quantity="[7,53]" probability="100.0"/>
			<item value="karmazynowa tarcza" quantity="[1,1]" probability="0.5"/>
			<item value="karmazynowy hełm" quantity="[1,1]" probability="0.005"/>
			<item value="piekielny sztylet" quantity="[1,1]" probability="0.0001"/>
		</drops>
		<equips/>
		<ai>
			<profile name="brave"/>
			<profile name="offensive"/>
			<profile name="human"/>
			<profile name="patrolling"/>
		</ai>
	</creature>

	<!-- END: czart -->

</creatures>