<?xml version="1.0" encoding="UTF-8"?>
<creatures xmlns="stendhal" xmlns:xsi="http://www.w3.org/2001/XMLSchema-instance"
	xsi:schemaLocation="stendhal ../../creatures.xsd ">

	<!-- START: owady -->

	<creature name="chmara much">
		<type class="pol/owady" subclass="chmara_much" tileid="pol_owady.png:0"/>
		<description>Oto muchy plujki. Przyciąga je smród padliny.</description>
		<attributes>
			<atk value="1"/>
			<def value="1"/>
			<hp value="5"/>
			<speed value="0.7"/>
			<size value="1,1"/>
			<resistance value="25"/>
		</attributes>
		<level value="0"/>
		<experience value="0"/>
		<respawn value="159"/>
		<corpse name="fly"/>
		<drops/>
		<equips/>
		<ai>
			<says>
				<noise state="idle follow fight" value="Bzzzyy!"/>
				<sound value="pol-buzz"/>
			</says>
			<profile name="animal"/>
			<profile name="offensive"/>
			<profile name="coward"/>
			<profile name="patrolling"/>
		</ai>
	</creature>

	<creature name="rój os">
		<type class="pol/owady" subclass="roj_os" tileid="pol_owady.png:1"/>
		<description>Osy żądlą boleśnie. Jeśli masz przy sobie odtrutkę to przeżyjesz.</description>
		<attributes>
			<atk value="15"/>
			<def value="30"/>
			<hp value="30"/>
			<speed value="0.8"/>
			<size value="1,1"/>
			<resistance value="50"/>
		</attributes>
		<level value="0"/>
		<experience value="5"/>
		<respawn value="283"/>
		<corpse name="fly"/>
		<drops/>
		<equips/>
		<ai>
			<says>
				<noise state="idle follow fight" value="Bzzzzzzzzzzzz!"/>
				<sound value="pol-buzz"/>
			</says>
			<profile name="poisonous" params="3,trucizna"/>
			<profile name="animal"/>
			<profile name="offensive"/>
			<profile name="brave"/>
			<profile name="patrolling"/>
		</ai>
	</creature>

	<creature name="rój szerszeni">
		<type class="pol/owady" subclass="roj_szerszeni" tileid="pol_owady.png:2"/>
		<description>Jad szerszeni jest zabójczy. Mało kto przeżył ich atak.</description>
		<attributes>
			<atk value="45"/>
			<def value="50"/>
			<hp value="64"/>
			<speed value="0.9"/>
			<size value="1,1"/>
		</attributes>
		<level value="6"/>
		<experience value="62"/>
		<respawn value="904"/>
		<corpse name="fly"/>
		<drops/>
		<equips/>
		<ai>
			<says>
				<noise state="idle follow fight" value="Bżżżżżżżżż!"/>
				<sound value="pol-buzz"/>
			</says>
			<profile name="heal" params="1,50"/>
			<profile name="poisonous" params="9,mocna trucizna"/>
			<profile name="animal"/>
			<profile name="offensive"/>
			<profile name="brave"/>
			<profile name="patrolling"/>
		</ai>
	</creature>

	<creature name="motylek">
		<type class="pol/owady" subclass="motylek" tileid="pol_owady.png:3"/>
		<description>O! Popatrz! Leci motylek! Nie dosięgniesz go...</description>
		<attributes>
			<atk value="1"/>
			<def value="22000"/>
			<hp value="1"/>
			<speed value="1.0"/>
			<size value="1,1"/>
			<resistance value="1"/>
		</attributes>
		<level value="1"/>
		<experience value="1"/>
		<respawn value="3000"/>
		<corpse name="fly"/>
		<drops/>
		<equips/>
		<ai>
			<profile name="animal"/>
			<profile name="offensive"/>
			<profile name="coward"/>
			<profile name="patrolling"/>
		</ai>
	</creature>

	<!-- END: owady -->

</creatures>