<?xml version="1.0" encoding="UTF-8"?>
<creatures xmlns="stendhal" xmlns:xsi="http://www.w3.org/2001/XMLSchema-instance"
	xsi:schemaLocation="stendhal ../../creatures.xsd ">

	<!-- START: ptaki wielkie -->

	<creature name="orzeÅ‚ gigant">
		<type class="pol/ptaki_wielkie" subclass="orzel_gigant" tileid="pol_ptaki_wielkie.png:0"/>
		<description/>
		<attributes>
			<atk value="4300"/>
			<def value="140"/>
			<hp value="5000"/>
			<speed value="1.0"/>
			<size value="2,2"/>
			<resistance value="1"/>
		</attributes>
		<level value="270"/>
		<experience value="280000"/>
		<respawn value="259200"/>
		<corpse name="giant_knight"/>
		<drops>
			<item value="udko" quantity="[11,24]" probability="100.0"/>
			<item value="jajo" quantity="[1,2]" probability="10.0"/>
		</drops>
		<equips/>
		<ai>
			<says>
			</says>
			<profile name="brave"/>
			<profile name="animal"/>
			<profile name="offensive"/>
			<profile name="lifesteal" params="0.05"/>
			<profile name="heal" params="10,25"/>
			<profile name="attack weakest"/>
		</ai>
	</creature>

	<!-- END: ptaki wielkie -->

</creatures>